" Product Code"," Product Description","HS 1988/92 Product Code","HS 1988/92 Product Description"
"820330","Metal-cutting shears & similar tools","820330","Metal cutting shears, tinmen's snips and oth me"
"820340","Pipe-cutters, bolt croppers, perforating punches & similar tools","820340","Pipe-cutters, bolt croppers, perforating punche"
"820411","Hand-operated spanners & wrenches, non-adjustable","820411","Wrenches, hand-operated, with non-adjustable ja"
"820412","Hand-operated spanners & wrenches, adjustable","820412","Wrenches, hand-operated, with adjustable jaws"
"820420","Interchangeable spanner sockets, with/without handles","820420","Wrench sockets including ratchet handles extens"
"820510","Drilling/threading/tapping tools, for use in the hand","820510","Drilling, threading or tapping tools"
"820520","Hammers & sledge hammers","820520","Hammers and sledge hammers"
"820530","Planes, chisels, gouges & similar cutting tools for working wood, for use in the hand","820530","Planes, chisels, gouges and similar cutting too"
"820540","Screwdrivers","820540","Screwdrivers"
"820551","Household tools for use in the hand, n.e.s.","820551","Curling irons, cork screws, nut-crackers and ot"
"820559","Hand tools (incl. glaziers' diamonds), n.e.s.","820559","Tools for masons, watchmakers, miners and hand"
"820560","Blow lamps","820560","Blow torches"
"820570","Vices, clamps & the like","820570","Vices, clamps and the like"
"820580","Anvils; portable forges; hand/pedal-operated grinding wheels with frameworks","820580","Anvils, portable forges and hand or pedal-opera"
"820590","Sets of articles of 2/more of the SHs of 82.05","820590","Sets of articles of two or more of the foregoin"
"820600","Tools of 2/more of the headings of 82.02-82.05, put up in sets for RS","820600","Tools of two or more of the heading Nos 82.02 t"
"820713","Rock drilling/earth boring tools with working part of cermets, for hand tools, whether/not power-operated/for machine tools","820711","Rock drilling or earth boring tools with workin"
"820719","Rock drilling/earth boring tools other than those with working parts of cermets, incl. parts, for hand tools, whether/not power-operated/for machine tools","820712","Rock drilling or earth boring tools with workin"
"820720","Dies for drawing/extruding metal, for hand tools, whether/not power-operated/for machine tools","820720","Dies for drawing or extruding metal"
"820730","Tools for pressing/stamping/punching, for hand tools, whether/not power-operated/for machine tools","820730","Tools for pressing, stamping or punching"
"820740","Tools for tapping/threading, for hand tools, whether/not power-operated/for machine tools","820740","Tools for taping or threading"
"820750","Tools for drilling, other than for rock drilling, for hand tools, whether/not power-operated/for machine tools","820750","Tools for drilling, other than for rock drillin"
"820760","Tools for boring/broaching, for hand tools, whether/not power-operated/for machine tools","820760","Tools for boring or broaching"
"820770","Tools for milling, for hand tools, whether/not power-operated/for machine tools","820770","Tools for milling"
"820780","Tools for turning, for hand tools, whether/not power-operated/for machine tools","820780","Tools for turning"
"820790","Interchangeable tools for hand tools, n.e.s. in 82.07, whether/not power-operated/for machine tools","820790","Screwdriver bits, lapping tools and other inter"
"820810","Knives & cutting blades, for machines/mechanical appliances, for metal working","820810","Knives and blades for machines or mechanical ap"
"820820","Knives & cutting blades, for machines/mechanical appliances, for wood working","820820","Knives and blades for machines or mechanical ap"
"820830","Knives & cutting blades, for machines/mechanical appliances, for kitchen appliances/for machines used by the food industry","820830","Knives and blades for kitchen appliances or foo"
"820840","Knives & cutting blades, for machines/mechanical appliances, for agricultural/horticultural/forestry machines","820840","Knives and blades for agricultural, horticultur"
"820890","Knives & cutting blades, for machines/mechanical appliances (excl. of 8208.10-8208.40)","820890","Knives and blades for leather, paper, tobacco m"
"820900","Plates, sticks, tips & the like for tools, unmounted, of cermets","820900","Plates, tips and the like for tools of sintered"
"821000","Hand-operated mechanical appliances, weighing 10kg/less, used in the preparation/conditioning/serving of food/drink","821000","Hand-operated mechanical appliances,weighing 10"
"821110","Sets of assorted knives with cutting blades, whether/not serrated, incl. pruning knives, other than knives of 82.08, & blades therefor","821110","Sets of different knives or sets of different a"
"821191","Table knives having fixed blades, whether/not serrated","821191","Table knives having fixed blades"
"821192","Knives having fixed blades (excl. table knives & knives of 82.02), whether/not serrated","821192","Butcher's knives, hunting knives and other kniv"
"821193","Knives having other than fixed blades, whether/not serrated","821193","Pocket and pen knives and other knives with fol"
"821194","Blades for knives, whether/not serrated","821194","Blades for knives of hd 8211.10 to 8211.94"
"821195","Handles for knives, of base metal","821192","Butcher's knives, hunting knives and other kniv"
"821210","Razors (excl. plastic razors presented without their blades, & electric razors)","821210","Razors including safety razors and open blade t"
"821220","Safety razor blades, incl. razor blade blanks in strips","821220","Safety razor blades, including razor blade blan"
"821290","Parts of razors, other than blades","821290","Parts of non-electric razors"
"821300","Scissors, tailors' shears & similar shears, & blades therefor","821300","Scissors, tailors' shears and similar shears, a"
"821410","Paper knives, letter openers, erasing knives, pencil sharpeners & blades therefor","821410","Paper knives,letter openers,erasing knives,penc"
"821420","Manicure/pedicure sets & instr. (incl. nail files)","821420","Manicure or pedicure sets and instruments (incl"
"821490","Articles of cutlery (e.g., hair clippers, butchers'/kitchen cleavers, choppers & mincing knives) n.e.s. in Ch.82","821490","Kitchen chopper, cleavers and mincing knives an"
"821510","Sets of assorted spoons, forks, ladles & similar kitchen/tableware articles containing at least one article plated with precious metal","821510","Tableware sets containing at least one article"
"821520","Sets of assorted kitchen/tableware articles (excl. of 8215.10)","821520","Tableware sets not containing articles plated w"
"821591","Spoons, forks, ladles, skimmers, cake-servers, fish-knives, butter-knives, sugar tongs & similar kitchen/tableware, plated with precious metal","821591","Tableware articles not in sets plated with prec"
"821599","Spoons, forks, ladles, skimmers, cake-servers, fish-knives, butter-knives, sugar tongs & similar kitchen/tableware (excl. of 8215.10-8215.91)","821599","Tableware articles not in sets and not plated w"
"830110","Padlocks, of base metal","830110","Padlocks of base metal"
"830120","Locks of a kind used for motor vehicles, of base metal","830120","Locks of a kind used for motor vehicles of base"
"830130","Locks of a kind used for furniture, of base metal","830130","Locks of a kind used for furniture of base meta"
"830140","Locks (key/combination/electrically operated), of base metal (excl. of 8301.10-8310.30)","830140","Locks of base metal, nes"
"830150","Clasps & frames with clasps, incorporating locks, of base metal","830150","Clasps and frames with clasps, incorporating lo"
"830160","Parts of locks, of base metal","830160","Lock parts,including parts of clasps or frames"
"830170","Keys for any of the locks of 8301.10-8301.40, presented sep., of base metal","830170","Keys, including blanks for keys presented separ"
"830210","Hinges of base metal","830210","Hinges of base metal"
"830220","Castors of base metal","830220","Castors of base metal"
"830230","Mountings, fittings & similar articles suit. for motor vehicles, of base metal (excl. of 8302.10 & 8302.20)","830230","Mountings,fittings and similar art. of base mtl"
"830241","Mountings, fittings & similar articles suit. for buildings, of base metal (excl. of 8302.10 & 8310.20)","830241","Mountings, fittings and similar articles of bas"
"830242","Mountings, fittings & similar articles suit. for furniture, of base metal (excl. of 8302.10 & 8310.20)","830242","Mountings, fittings and similar articles of bas"
"830249","Mountings, fittings & similar articles (e.g., suit. for saddlery/trunks/chests/caskets/the like), n.e.s. in 83.02, of base metal","830249","Mountings, fittings and similar articles of bas"
"830250","Hat-racks, hat-pegs, brackets & similar fixtures, of base metal","830250","Hat-racks, hat-pegs, brackets and similar fixtu"
"830260","Automatic door closers, of base metal","830260","Door closures, automatic, of base metal"
"830300","Armoured/reinforcededed safes, strong-boxes & doors & safe deposit lockers for strong-rooms, cash/deed boxes & the like, of base metal","830300","Safes,safe deposit lockers,cash,deep or strong"
"830400","Filing cabinets, card-index cabinets, paper trays, paper rests, pen trays, office-stamp stands & similar office/desk equip., of base metal (excl. office furniture of 94.03)","830400","Office/desk equipment,base mtl eg filing cab,tr"
"830510","Fittings for loose-leaf binders/files, of base metal","830510","Fitting for loose-leaf binders or files of base"
"830520","Staples in strips (e.g., for offices, upholstery, packaging), of base metal","830520","Staples in strips,base mtl,nes (eg for offices,"
"830590","Fittings for office articles (e.g., letter clips, letter corners, paper clips, indexing tags), other than fittings for looseleaf binders/files & staples in strips, incl. parts, of base metal","830590","Letter corners,letter or paper clips and simila"
"830610","Bells, gongs & the like, non-electric, of base metal","830610","Bells, gongs and the like, of base metal"
"830621","Statuettes & other ornaments, of base metal plated with precious metal","830621","Statuettes and other ornaments plated with prec"
"830629","Statuettes & other ornaments, of base metal (excl. of 8306.21)","830629","Statuettes and other ornaments, nes"
"830630","Photograph/picture/similar frames, of base metal; mirrors of base metal","830630","Photograph, picture, or similar frames and mirr"
"830710","Flexible tubing of base metal, with/without fittings, of iron/steel","830710","Tubing, flexible, with or without fittings of i"
"830790","Flexible tubing of base metal, with/without fittings, of base metals other than iron/steel","830790","Tubing, flexible, with or without fittings, of"
"830810","Hooks, eyes & eyelets of a kind used for clothing/footwear/awnings/handbags/travel goods/other made-up articles, of base metal","830810","Hooks,eyes and eyelets of base mtl for clothing"
"830820","Tubular/bifurcated rivets, of base metal","830820","Rivets,tubular or bifurcated,of base mtl for cl"
"830890","Clasps, frames with clasps, buckles, buckle-clasps, & the like, of base metal, of a kind used for clothing, footwear, awnings, handbags, travel goods/other made up articles (excl. of 8308.10 & .20), incl. parts; beads & spangles, of base metal.","830890","Beads, spangles & other made up art nes,for clo"
"830910","Crown corks, of base metal","830910","Corks, crown, of base metal"
"830990","Stoppers, caps & lids (incl. screw caps & pouring stoppers; excl. crown corks), capsules for bottles, threaded bungs, bung covers, seals & other packing accessories, of base metal","830990","Stoppers,caps,lids,seals and oth packing access"
"831000","Sign-plates, name-plates, address-plates & similar plates, numbers, letters & other symbols, of base metal (excl. of 94.05)","831000","Letters,numbers,sign plates&sim art of base mtl"
"831110","Coated electrodes of base metal, for electric arc-welding","831110","Electrodes, coated, of base metal, for electric"
"831120","Cored wire of base metal, for electric arc-welding","831120","Wire, cored, of base metal, for electric arc we"
"831130","Coated rods & cored wire, of base metal, for soldering/brazing/welding by flame","831130","Coated rods and cored wire of base mtl for sold"
"831190","Wire, rods, tubes, plates, electrodes & similar products (incl. parts), of base metal/metal carbides, coated/cored with flux material, of a kind used for soldering, brazing, welding/deposition of metql/of metal carbides; .(excl. of 8311.10-8311.30); wire","831190","Electrodes&sim prod of base mtl/mtl carbd,nes,f"
"840110","Nuclear reactors","840110","Nuclear reactors"
"840120","Machinery & apparatus for isotopic separation, & parts thereof","840120","Machinery and apparatus for isotopic separation"
"840130","Fuel elements (cartridges), non-irradiated","840130","Fuel elements (cartridges), non-irradiated, for"
"840140","Parts of nuclear reactors","840140","Parts of nuclear reactors"
"840211","Watertube boilers with a steam production >45t per hour (excl. central heating hot water boilers capable also of producing low pressure steam)","840211","Watertube boilers with a steam production excee"
"840212","Watertube boilers with a steam production not >45 t per hour (excl. central heating hot water boilers capable also of producing low pressure steam)","840212","Watertube boilers with a steam production not e"
"840219","Vapour generating boilers, incl. hybrid boilers (excl. of 8402.11 & 8402.12; excl. central heating hot water boilers capable also of producing low pressure steam)","840219","Vapour generating boilers nes, including hybrid"
"840220","Super-heated water boilers","840220","Super-heated water boilers"
"840290","Parts of the boilers of 8402.11-8402.20","840290","Parts of steam or vapour generating boilers nes"
"840310","Central heating boilers (excl. of 84.02)","840310","Central heating boilers nes"
"840390","Parts of the boilers of 8403.10","840390","Parts of central heating boiler nes"
"840410","Auxiliary plant for use with boilers of 84.02/84.03 (e.g., economisers, super-heaters, soot removers, gas recoverers)","840410","Auxiliary plant for use with steam or vapour ge"
"840420","Condensers for steam/other vapour power units","840420","Condensers for steam or vapour power units"
"840490","Parts of the auxiliary plant of 8404.10 & 8404.20","840490","Parts for auxiliary plant & condenser for steam"
"840510","Producer gas/water gas generators, with/without their purifiers; acetylene gas generators & similar water process gas generators, with/without their purifiers","840510","Producer gas or water gas generators acetylene"
"840590","Parts of the producer gas/water gas generators/acetylene gas & similar water process gas generators of 8405.10","840590","Parts of prod gas or wat gas gen,acetylene gas"
"840610","Steam turbines & other vapour turbines for marine propulsion","840611","Steam and vapour turbines for marine propulsion"
"840681","Steam turbines & other vapour turbines (excl. for marine propulsion), of an output >40MW","840619","Steam and vapour turbines nes"
"840682","Steam turbines & other vapour turbines (excl. for marine propulsion), of an output not >40MW","840619","Steam and vapour turbines nes"
"840690","Parts of the steam turbines & other vapour turbines of 8406.10-8406.82","840690","Parts of steam and vapour turbines"
"840710","Spark-ignition reciprocating/rotary internal combustion piston engines for aircraft","840710","Aircraft engines, spark-ignition reciprocating"
"840721","Spark-ignition reciprocating/rotary internal combustion piston engines for outboard motors","840721","Outboard motors, spark-ignition reciprocating o"
"840729","Spark-ignition reciprocating/rotary internal combustion piston engines for marine propulsion (excl. outboard motors)","840729","Marine engines nes of the spark-ignition recipr"
"840731","Spark ignition reciprocating piston engines of a kind used for the propulsion of vehicles of Ch.87, of a cylinder capacity not >50cc","840731","Engines, spark-ignition reciprocating, displaci"
"840732","Spark ignition reciprocating piston engines of a kind used for the propulsion of vehicles of Ch.87, of a cylinder capacity >50cc but not >250cc","840732","Engines, spark-ignition reciprocating, displaci"
"840733","Spark ignition reciprocating piston engines of a kind used for the propulsion of vehicles of Ch.87, of a cylinder capacity >250cc but not >1000cc","840733","Engines, spark-ignition reciprocating displacin"
"840734","Spark ignition reciprocating piston engines of a kind used for the propulsion of vehicles of Ch.87, of a cylinder capacity >1000cc","840734","Engines, spark-ignition reciprocating displacin"
"840790","Spark-ignition reciprocating/rotary internal combustion piston engines (excl. of 8407.10-8407.29)","840790","Engines, spark-ignition type nes"
"840810","Compression-ignition internal combustion piston engines (diesel/semi-diesel engines) for marine propulsion","840810","Marine propulsion engines, diesel"
"840820","Compression-ignition internal combustion piston engines (diesel/semi-diesel engines) of a kind used for the propulsion of vehicles of Ch.87","840820","Engines, diesel, for the vehicles of Chapter 87"
"840890","Internal combustion piston engines (diesel/semi-diesel engines) (excl. of 8408.10 & 8408.20)","840890","Engines, diesel nes"
"840910","Parts suit. for use solely/principally with the aircraft engines of 84.07","840910","Parts for spark-ignition type aircraft engines"
"840991","Parts suit. for use solely/principally with spark-ignition internal combustion piston engines","840991","Parts for spark-ignition type engines nes"
"840999","Parts suit. for use solely/principally with the engines of 84.07/84.08 (excl. of 8409.10 & 8409.91)","840999","Parts for diesel and semi-diesel engines"
"841011","Hydraulic turbines & water wheels, of a power not >1000kW","841011","Hydraulic turbines & water wheels of a power no"
"841012","Hydraulic turbines & water wheels, of a power >1000kW but not >10000kW","841012","Hyd turbines & water wheels of a power exc 1000"
"841013","Hydraulic turbines & water wheels, of a power >10000kW","841013","Hydraulic turbines and water wheels of a power"
"841090","Parts (incl. regulators) of the hydraulic turbines & water wheels of 8410.11-8410.13","841090","Parts of hydraulic turbines & water wheels incl"
"841111","Turbo-jets, of a thrust not >25kN","841111","Turbo-jets of a thrust not exceeding 25 KN"
"841112","Turbo-jets, of a thrust >25 kN","841112","Turbo-jets of a thrust exceeding 25 KN"
"841121","Turbo-propellers, of a power not >1,100kW","841121","Turbo-propellers of a power not exceeding 1100"
"841122","Turbo-propellers, of a power >1,100kW","841122","Turbo-propellers of a power exceeding 1100 KW"
"841181","Gas turbines other than turbo-jets/turbo-propellers, of a power not >5000kW","841181","Gas turbines nes of a power not exceeding 5000"
"841182","Gas turbines other than turbo-jets/turbo-propellers, of a power >5000kW","841182","Gas turbines nes of a power exceeding 5000 KW"
"841191","Parts of the turbo-jets/turbo-propellers of 8411.11-8411.22","841191","Parts of turbo-jets or turbo-propellers"
"841199","Parts of the other gas turbines of 8411.81 & 8411.82","841199","Parts of gas turbines nes"
"841210","Reaction engines other than turbo-jets","841210","Reaction engines nes other than turbo jets"
"841221","Linear acting (cylinders) hydraulic power engines & motors","841221","Hydraulic power engines & motors linear acting"
"841229","Hydraulic power engines & motors other than linear acting (cylinders)","841229","Hydraulic power engines & motors nes"
"841231","Linear acting (cylinders) pneumatic power engines & motors","841231","Pneumatic power engines & motors linear acting"
"841239","Pneumatic power engines & motors other than linear acting (cylinders)","841239","Pneumatic power engines & motors nes"
"841280","Engines & motors n.e.s. in Ch.84","841280","Engines and motors nes"
"841290","Parts of the engines & motors of 8412.10-8412.80","841290","Parts of hydraulic & pneumatic & other power en"
"841311","Pumps for dispensing fuel/lubricants, of the type used in filling-stations/garages","841311","Pumps with or w/o a meas device for disp fuel/l"
"841319","Pumps for liquids, fitted/designed to be fitted with a measuring device (excl. of 8413.11)","841319","Pumps fitted or designed to be fitted with a me"
"841320","Hand pumps for liquids (excl. of 8413.11 & 8413.19)","841320","Hand pumps nes, o/t those of subheading No 8413"
"841330","Fuel/lubricating/cooling medium pumps for internal combustion piston engines","841330","Fuel, lubricating or cooling medium pumps for i"
"841340","Concrete pumps","841340","Concrete pumps"
"841350","Reciprocating positive displacement pumps (excl. of 8413.11-8413.40)","841350","Reciprocating positive displacement pumps nes"
"841360","Rotary positive displacement pumps (excl. of 8413.11-8413.40)","841360","Rotary positive displacement pumps nes"
"841370","Centrifugal pumps (excl. of 8413.11-8413.40)","841370","Centrifugal pumps nes"
"841381","Pumps n.e.s. in 84.13","841381","Pumps nes"
"841382","Liquid elevators","841382","Liquid elevators"
"841391","Parts of the pumps of 8413.11-8413.81","841391","Parts of pumps for liquid whether or not fitted"
"841392","Parts of liquid elevators","841392","Parts of liquid elevators"
"841410","Vacuum pumps","841410","Vacuum pumps"
"841420","Hand-/foot-operated air pumps","841420","Hand or foot-operated air pumps"
"841430","Compressors of a kind used in refrigerating equip.","841430","Compressors of a kind used in refrigerating equ"
"841440","Air compressors mounted on a wheeled chassis for towing","841440","Air compressors mounted on a wheeled chassis fo"
"841451","Table/floor/wall/window/ceiling/roof fans, with a self-contained electric motor of an output not >125W","841451","Fans: table,roof etc with a self-cont elec mtr"
"841459","Fans, other than table/floor/wall/window/ceiling/roof fans, with a self-contained electric motor of an output not >125W","841459","Fans nes"
"841460","Ventilating/recycling hoods incorporating a fan, whether/not fitted with filters, having a maximum horizontal side not >120cm","841460","Hoods having a maximum horizontal side not exce"
"841480","Air pumps, air/other gas compressors & fans (excl. of 8414.10-8414.59); ventilating/recycling hoods incorporating a fan, whether/not fitted with filters (excl. of 8414.60)","841480","Air or gas compressors, hoods"
"841490","Parts of the pumps, compressors, fans & recycling hoods of 8414.10-8414.20","841490","Parts of vacuum pumps, compressors, fans, blowe"
"841510","Window/wall type air-conditioning machines, self-contained/split-system, comprising a motor-driven fan & elements for changing the temp. & humidity, including those machines in which the humidity cannot be separately regulated","841510","Air conditioning machines window or wall types,"
"841520","Air-conditioning machines of a kind used for persons, in motor vehicles","841582","Air cond mach nes, inc a refrigerating unit"
"841581","Air-conditioning machines incorporating a refrigerating unit & a valve for reversal of the cooling/heat cycle (reversible heat pumps)","841581","Air cond mach nes inc a ref unit and a valve fo"
"841582","Air-conditioning machines (excl. of 8415.10-8415.81), incorporating a refrigerating unit","841582","Air cond mach nes, inc a refrigerating unit"
"841583","Air-conditioning machines (excl. of 8415.10-8415.81), not incorporating a refrigerating unit","841583","Air cond mach nes, not incorporating refrigerat"
"841590","Parts of the air-conditioning machines of 8415.10-8415.83","841590","Parts of air conditioning machines"
"841610","Furnace burners for liquid fuel","841610","Furnace burners for liquid fuel"
"841620","Furnace burners other than those for liquid fuel, incl. combination burners","841620","Furnace burners nes, including combination burn"
"841630","Mechanical stokers (incl. their mechanical grates), mechanical ash dischargers & similar appliances","841630","Mech.stokers, mech.grates, mech.ash dischargers"
"841690","Parts of the furnace burners, mechanical stokers & mechanical ash dischargers & similar appliances of 8416.10-8416.30","841690","Parts of furnace burners,mech stokers grates,as"
"841710","Furnaces & ovens for the roasting/melting/other heat-treatment of ores/pyrites/metals, non-electric","841710","Furnaces&ovens n-elec for the roast,melt or h-t"
"841720","Bakery ovens, incl. biscuit ovens, non-electric","841720","Bakery ovens, including biscuit ovens, non-elec"
"841780","Industrial/laboratory furnaces & ovens (excl. of 8147.10 & 8417.20), incl. incinerators, non-electric","841780","Industrial or lab furnaces & ovens, inc inciner"
"841790","Parts of the industrial/laboratory furnaces & ovens of 8417.10-8417.80","841790","Parts of industrial or lab furnaces & ovens inc"
"841810","Combined refrigerator-freezers, fitted with separate external doors, electric/other","841810","Combined refrigerator-freezers, fitted with sep"
"841821","Refrigerators, h-hold. type, compression-type, electric/other","841821","Refrigerators, household type, compression-type"
"841829","Refrigerators, household type, excl. compression type.","841829","Refrigerators, household type, nes"
"841830","Freezers of the chest type, not >800 l capacity, electric/other","841830","Freezers of the chest type, not exceeding 800 l"
"841840","Freezers of the upright type, not >900 l capacity, electric/other","841840","Freezers of the upright type, not exceeding 900"
