" Product Code"," Product Description","HS 1988/92 Product Code","HS 1988/92 Product Description"
"320419","Synthetic organic colouring matter & preparations based thereon as spec. in Note 3 to Ch.32, incl. mixtures of colouring matter of 2/more headings of 3204.11-3204.19, n.e.s. in Ch.32","320419","Synthetic organic colouring matter and preparat"
"320420","Synthetic organic products of a kind used as fluorescent brightening agents","320420","Synthetic organic products used as fluorescent"
"320490","Synthetic organic products of a kind used as luminophores, whether/not chemically defined","320490","Synthetic organic products used as luminophores"
"320500","Colour lakes; preparations as spec. in Note 3 to Ch.32 based on colour lakes","320500","Colour lakes; preparations based on colour lake"
"320611","Pigments & preparations based on titanium dioxide, containing 80%/more by weight of titanium dioxide calc. on the dry matter","320610","Pigments and preparations based on titanium dio"
"320619","Pigments & preparations based on titanium dioxide other than those containing 80%/more by weight of titanium dioxide calc. on the dry matter","320610","Pigments and preparations based on titanium dio"
"320620","Pigments & preparations based on chromium comps.","320620","Pigments and preparations based on chromium com"
"320641","Ultramarine & preparations based thereon","320641","Ultramarine and preparations based thereon"
"320642","Lithopone & other pigments & preparations based on zinc sulphide","320642","Lithopone and other pigments and preparations b"
"320649","Colouring matter&other preparations,n.e.s. in Ch 32","320649","Other colouring matter; preparations as specifi"
"320650","Inorganic products of a kind used as luminophores","320650","Inorganic products of a kind used as luminophor"
"320710","Prepared pigments, prepared opacifiers, prepared colours & similar preparations","320710","Prepared pigments, opacifiers and colours... fo"
"320720","Vitrifiable enamels & glazes, engobes (slips) & similar preparations","320720","Vitrifiable enamels and glazes, englobes and si"
"320730","Liquid lustres & similar preparations","320730","Liquid lustres and similar preparations"
"320740","Glass frit & other glass, in the form of powder/granules/flakes","320740","Glass frit and other glass in the form of powde"
"320810","Paints & varnishes (incl. enamels & lacquers) based on polyesters","320810","Paints... based on polyesters, in a non-aqueous"
"320820","Paints & varnishes (incl. enamels & lacquers) based on acrylic/vinyl polymers","320820","Paints... based on acrylic or vinyl polymers, i"
"320890","Paints & varnishes (incl. enamels & lacquers, excl. of 3208.10 & 3208.20) based on synthetic polymers/chemically modified natural polymers, dispersed/dissolved in a non-aqueous medium; solutions as defined in Note 4 to this Ch.","320890","Paints and varnishes, in a non-aqueous medium,"
"320910","Paints & varnishes (incl. enamels & lacquers) based on acrylic/vinyl polymers","320910","Paints... based on acrylic or vinyl polymers, i"
"320990","Paints & varnishes (incl. enamels & lacquers) based on synthetic polymers/chemically modified natural polymers other than acrylic/vinyl polymers, dispersed/dissolved in an aqueous medium","320990","Paints and varnishes, in an aqueous medium, nes"
"321000","Paints & varnishes (incl. enamels, lacquers & distempers; excl. of 32.08 & 32.09); prepared water pigments of a kind used for finishing leather","321000","Other paints and varnishes (incl. enamels...).."
"321100","Prepared driers","321100","Prepared driers"
"321210","Stamping foils","321210","Stamping foils"
"321290","Pigments (incl. metallic powders & flakes) dispersed in non-aqueous media/in liquid/paste form, of a kind used in the manufacture of paints (incl. enamels); dyes & other colouring matter put up in forms/packings-RS","321290","Pigments in non-aqueous media, nes, for retail"
"321310","Artists'/students'/signboard painters' colours in sets","321310","Colours in sets"
"321390","Artists'/students'/signboard painters' colours, modifying tints, amusement colours&the like, in tablets/tubes/jars/bottles/pans/in similar forms/packings, other than in sets","321390","Artists', students' or signboard painters' colo"
"321410","Glaziers' putty, grafting putty, resin cements, caulking comps. & other mastics; painters' fillings","321410","Mastics and painters fillings"
"321490","Non-refractory surfacing preparations for fa?ades/indoor walls/floors/ceilings/the like","321490","Glaziers putty, etc, non-refractory surfacing p"
"321511","Printing ink, black","321511","Black printing ink, whether or not concentrated"
"321519","Printing ink (excl. black)","321519","Printing ink, whether or not concentrated or so"
"321590","Writing/drawing ink & other inks, other than printing ink, whether/not concentrated/solid","321590","Other ink, whether or not concentrated or solid"
"330112","Essential oils of orange","330112","Essential oils of orange (incl. concretes and a"
"330113","Essential oils of lemon","330113","Essential oils of lemon (incl. concretes and ab"
"330119","Essential oils of citrus fruit, other than of orange/lemon","330119","Essential oils of citrus fruit (incl. concretes"
"330124","Essential oils of peppermint (Mentha piperita)","330124","Essential oils of peppermint (incl. concretes a"
"330125","Essential oils of mints other than peppermint","330125","Essential oils of mints (incl. concretes and ab"
"330129","Essential oils other than those of citrus fruit (excl. of 3301.24 & 3301.25)","330129","Essential oils (incl. concretes and absolutes),"
"330130","Resinoids","330130","Resinoids"
"330190","Essential oils (terpeneless/not), including concretes & absolutes(excl. of 3301.12-3301.29);extracted oleoresins; concentrates of essential oils in fats, in fixed oils, in waxes/the like, obtained by enfleurage/maceration; terpenic by-products of the det","330190","Concentrates of essential oils in fats... aqueo"
"330210","Mixtures of odoriferous substance & mixtures (incl. alcoholic solutions) with a basis of one/more of these substance, of a kind used in the food/drink industries","330210","Mixtures of odoriferous substances, for the foo"
"330290","Mixtures of odoriferous substance & mixtures, incl. alcoholic solutions, with a basis of one/more of these substance, of a kind used as raw materials in industry other than food/drink industries","330290","Mixtures of odoriferous substances, as raw mate"
"330300","Perfumes & toilet waters","330300","Perfumes and toilet waters"
"330410","Lip make-up preparations","330410","Lip make-up preparations"
"330420","Eye make-up preparations","330420","Eye make-up preparations"
"330430","Manicure/pedicure preparations","330430","Manicure or pedicure preparations"
"330491","Powders, whether/not compressed, for beauty/make-up/care of the skin (excl. meds.; excl. of 3304.10-3304.30)","330491","Powders, whether or not compressed, for cosmeti"
"330499","Beauty/make-up preparations & preparations for the care of the skin (excl. meds.; excl. of 3304.10-3304.91), incl. sunscreen/sun tan preparations","330499","Beauty, make-up, skin-care (incl. suntan), nes"
"330510","Shampoos","330510","Shampoos"
"330520","Preparations for permanent waving/straightening the hair","330520","Preparations for permanent waving or straighten"
"330530","Hair lacquers","330530","Hair lacquers"
"330590","Preparations for use on the hair (excl. of 3305.10-3305.30)","330590","Preparations for use on the hair, nes"
"330610","Dentifrices, in individual retail packages","330610","Dentifrices"
"330620","Yarn used to clean between the teeth (dental floss), in individual retail packages","540241","Single yarn of nylon or other polyamides, with"
"330690","Preparations for oral/dental hygiene, incl. denture fixative pastes & powders, in individual retail packages (excl. of 3306.10 & 3306.20)","330690","Preparations for oral or dental hygiene (incl."
"330710","Pre-shave/shaving/after-shave preparations","330710","Pre-shave, shaving or after-shave preparations"
"330720","Personal deodorants & antiperspirants","330720","Personal deodorants and antiperspirants"
"330730","Perfumed bath salts & other bath preparations","330730","Perfumed bath salts and other bath preparations"
"330741","Agarbatti & other odoriferous preparations which operate by burning","330741","Agarbatti and other odiferous preparations whic"
"330749","Preparations for perfuming/deodorizing rooms other than agarbatti & other odoriferous preparations which operate by burning","330749","Preparations for deodorizing rooms, nes"
"330790","Depilatories & other perfumery, cosmetic/toilet preparations, n.e.s.","330790","Other perfumery, cosmetic or toilet preparation"
"340111","Soap & organic surface-active products & preparations, in the form of bars, cakes, moulded pieces/shapes, & paper, wadding, felt & nonwovens, impregnated, coated/covered with soap/detergent, for toilet use(incl. medicated products)","340111","Soap and organic surface-active products in bar"
"340119","Soap & organic surface-active products & preparations, in the form of bars, cakes, moulded pieces/shapes, & paper, wadding, felt & nonwovens, impregnated, coated/covered with soap/detergent(excl. of 3401.11)","340119","Soap and organic surface-active products in bar"
"340120","Soap in other forms (excl. of 3401.11 & 3401.19)","340120","Soap in other forms, nes"
"340130","Organic surface-active products & preparations for washing the skin, in the form of liquid/cream & put up for RS, whether/not containing soap","340220","Washing and cleaning preparations, put up for r"
"340211","Anionic surface-active agents, whether/not PURS","340211","Anionic surface-active agents, (excl. soap)"
"340212","Cationic surface-active agents, whether/not PURS","340212","Cationic surface-active agents, (excl. soap)"
"340213","Non-ionic surface-active agents, whether/not PURS","340213","Non-ionic surface-active agents, (excl. soap)"
"340219","Organic surface-active agents, whether/not PURS (excl. of 3402.11-3402.13)","340219","Organic surface-active agents, (excl. soap), ne"
"340220","Surface-active preparations, washing preparations (incl. auxiliary washing preparations) & cleaning preparations, whether/not containing soap (excl. of 34.01/3402.11-3402.9), put up for RS","340220","Washing and cleaning preparations, put up for r"
"340290","Organic surface-active agents, surface-active preparations, washing preparations & cleaning preparations, n.e.s. in Ch.34","340290","Washing and cleaning preparations, not put up f"
"340311","Lubricating preparations containing petroleum oils/oils obt. from bituminous mins., for the treatment of textile materials/leather/furskins/other materials","340311","Lubricat.prep.for the treatment of textile mat."
"340319","Lubricating preparations containing petroleum oils/oils obt. from bituminous mins., other than for treatment of textile materials/leather/furskins/other materials","340319","Other lubricating preparations, with <70% petro"
"340391","Lubricating preparations (excl. those containing petroleum oils/oils obt. from bituminous mins.), for the treatment of textile materials/leather/furskins/other mats","340391","Lubricating prep.for the treatment of textiles"
"340399","Lubricating preparations (excl. those containing petroleum oils/oils obt. from bituminous mins.), other than for the treatment of textile materials/leather/furskins/other mats","340399","Other lubricating preparations, nes"
"340420","Artificial waxes & prepared waxes, of poly(oxyethylene) (polyethylene glycol)","340420","Artificial waxes of polyethylene glycol"
"340490","Artificial waxes & prepared waxes (excl. of  3404.20)","340490","Artificial waxes and prepared waxes, nes"
"340510","Polishes, creams & similar preparations for footwear/leather","340510","Polishes, creams and similar preparations for f"
"340520","Polishes, creams & similar preparations for the maintenance of wooden furniture/floors/other woodwork","340520","Polishes, creams and similar preparations for m"
"340530","Polishes & similar preparations for coachwork (excl. metal polishes)","340530","Polishes and similar preparations for coachwork"
"340540","Scouring pastes & powders & other scouring preparations","340540","Scouring pastes and powders and other scouring"
"340590","Polishes & creams, scouring pastes & powders & similar preparations (excl. waxes of 34.04; excl. of 3405.10-3405.40)","340590","Other polishes, creams and similar preparations"
"340600","Candles, tapers&the like","340600","Candles, tapers and the like"
"340700","Modelling pastes, including those put up for children's amusement; preparations known as dental wax/as dental impression compounds, put up in sets, in packings for retail sale/in plates, horseshoe shapes, sticks/similar forms; other preparations","340700","Modelling pastes; dental wax and impression com"
"350110","Casein","350110","Casein"
"350190","Caseinates & other casein derivatives; casein glues","350190","Caseinates and other casein derivatives; casein"
"350211","Dried egg albumin","350210","Egg albumin"
"350219","Egg albumin (excl. dried)","350210","Egg albumin"
"350220","Milk albumin, incl. concentrates of 2/more whey proteins","350290","Albumins (excl. egg albumin), albuminates and o"
"350290","Albumins (including concentrates of two/more whey proteins, containing by weight more than 80 % whey proteins, calculated on the dry matter), albuminates&other albumin derivatives (excl. of 3502.11 - 3502.20)","350290","Albumins (excl. egg albumin), albuminates and o"
"350300","Gelatin, incl. gelatin in rectangular (incl. square) sheets, whether/not surface-worked /coloured & gelatin derivatives; isinglass; other glues of animal origin (excl. casein glues of 35.01)","350300","Gelatin and derivatives; isinglass; glues of an"
"350400","Peptones&their derivatives; other protein substances&their derivatives, n.e.s/incld.; hide powder, whether/not chromed.","350400","Peptones/protein substances and derivatives, ne"
"350510","Dextrins & other modified starches","350510","Dextrins and other modified starches"
"350520","Glues based on starches/dextrins/other modified starches","350520","Glues based on starches, dextrins or other modi"
"350610","Products suit. for use as glues/adhesives, put up for RS as glues/adhesives, not > a net weight of 1kg","350610","Products put up as glues or adhesives for retai"
"350691","Adhesives based on polymers of 39.01-39.13/based on rubber","350691","Adhesives based on rubber or plastic (incl. art"
"350699","Prepared glues & other prepared adhesives, n.e.s. in 35.06","350699","Prepared glues and other prepared adhesives, ne"
"350710","Rennet & concentrates thereof","350710","Rennet and concentrates thereof"
"350790","Prepared enzymes, n.e.s., other than rennet & concentrates thereof","350790","Enzymes; prepared enzymes (not elsewhere specif"
"360100","Propellent powders","360100","Propellent powders"
"360200","Prepared explosives (excl. propellent powders)","360200","Prepared explosives, (excl. propellent powders)"
"360300","Safety fuses; detonating fuses; percussion/detonating caps; igniters; electric detonators","360300","Safety fuses; detonating fuses; caps; igniters;"
"360410","Fireworks","360410","Fireworks"
"360490","Signalling flares, rain rockets, fog signals & other pyrotechnic articles (excl. fireworks)","360490","Signalling flares... and other pyrotechnic arti"
"360500","Matches, other than pyrotechnic articles of 36.04","360500","Matches (excl. pyrotechnic articles of 36.04)"
"360610","Liquid/liquefied-gas fuels in containters of a kind used for filling/refilling cigarette/similar lighters & of a capacity not >300cm3","360610","Liquid or liquefied-gas fuels in containers, fo"
"360690","Ferro-cerium & other pyrophoric alloys in all forms; articles of combustible materials as spec. in Note 2 to Ch.36 (excl. of 3606.10)","360690","Ferro-cerium, pyrophoric alloys; articles of co"
"370110","Photographic plates & film in the flat, sensitised, unexposed, of any material other than paper/paperboard/textiles, for X-ray","370110","Photographic plates... for X-ray, in the flat,"
"370120","Instant print film in the flat, sensitised, unexposed, whether/not in packs","370120","Instant print flat film, unexposed"
"370130","Photographic plates & film in the flat (excl. film for X-rays, instant print film), sensitised, unexposed, of any material other than paper/paperboard/textiles, with any side >255mm","370130","Plates and film, in the flat with any side >255"
"370191","Photographic plates & film in the flat (excl. of 3701.20 & 3701.30), sensitised, unexposed, of any material other than paper/paperboard/textiles, for colour photography (polychrome)","370191","Photographic plates..., in the flat for colour"
"370199","Photographic plates & film in the flat, sensitised, unexposed, of any material other than paper/paperboard/textiles, n.e.s. in Ch.37","370199","Photographic plates and film, in the flat (excl"
"370210","Photographic film in rolls, sensitised, unexposed, of any material other than paper/paperboard/textiles, for X-ray","370210","Photographic film in rolls, for X-ray, unexpose"
"370231","Photographic film in rolls ( excl. film for X-ray),  without perforations, of a width not > 105 mm,for colour photography (polychrome)","370231","Polychrome film, in rolls, non-perforated, of w"
"370232","Photographic film in rolls ( excl. film for X-ray),  without perforations, of a width not >105 mm, with silver halide emulsion","370232","Film, in rolls, non-perforated, with silver..."
"370239","Photographic film in rolls ( excl. film for X-ray),  without perforations, of a width not >105 mm (excl. of 3702.31 & 3702.32)","370239","Film, in rolls, non-perforated, of width =<105m"
"370241","Photographic film in rolls ( excl. film for X-ray),  without perforations, of a width exceeding 610mm&of a length exceeding 200 m, for colour photography (polychrome)","370241","Polychrome film, in rolls, non-perforated, widt"
"370242","Photographic film in rolls ( excl. film for X-ray),  without perforations, of a width > 610mm&of a length > 200 m, other than for colour photography ","370242","Film, in rolls, non-perforated, width >610mm le"
"370243","Photographic film in rolls ( excl. film for X-ray),  without perforations, of a width > 610mm&of a length not >200 m","370243","Film, in rolls, non-perforated, width >610mm an"
"370244","Photographic film in rolls ( excl. film for X-ray),  without perforations, of a width > 105 mm but          not > 610 mm. ","370244","Film, in rolls, non-perforated, width >105mm bu"
"370251","Photographic film in rolls (excl. film for X-rays & instant print film), for colour photography (polychrome), of a width not >16mm & of a length not >14m","370251","Polychrome film, in rolls, width =<16mm and len"
"370252","Photographic film in rolls (excl. film for X-rays & instant print film), for colour photography (polychrome), of a width not >16mm & of a length >14m","370252","Polychrome film, in rolls, width =<16mm and len"
"370253","Photographic film in rolls (excl. film for X-rays & instant print film), for colour photography (polychrome), of a width >16mm but not >35mm & of a length not >30m, for slides","370253","Polychrome slide film, in rolls, width >16mm bu"
"370254","Photographic film in rolls (excl. film for X-rays & instant print film), for colour photography (polychrome), of a width >16mm but not >35mm & of a length not >30m, other than for slides","370254","Polychrome film, in rolls, width >16mm but =<35"
"370255","Photographic film in rolls (excl. film for X-rays & instant print film), for colour photography (polychrome), of a width >16mm but not >35mm & of a length >30m","370255","Polychrome film, in rolls, width >16mm but =<35"
"370256","Photographic film in rolls (excl. film for X-rays & instant print film), for colour photography (polychrome), of a width >35mm","370256","Polychrome film, in rolls, width >35mm"
"370291","Photographic film in rolls (excl. film for X-rays & instant print film), n.e.s., of a width not >16mm","370291","Film, in rolls, width =<16mm and length =<14m ("
"370293","Photographic film in rolls (excl. film for X-rays & instant print film), n.e.s., of a width >16mm but not >35mm & of a length not >30m","370293","Film, in rolls, width >16mm but =<35mm and leng"
"370294","Photographic film in rolls (excl. film for X-rays & instant print film), n.e.s., of a width >16mm but not >35mm & of a length >30m","370294","Film, in rolls, width >16mm but =<35mm and leng"
"370295","Photographic film in rolls (excl. film for X-rays & instant print film), n.e.s., of a width >35mm","370295","Film, in rolls, width >35mm (excl. colour)"
"370310","Photographic paper, paperboard & textiles, sensitised, unexposed, in rolls of a width >610mm","370310","Photographic paper, paperboard and textilles, i"
"370320","Photographic paper, paperboard & textiles, sensitised, unexposed, for colour photography (polychrome)","370320","Photographic paper, paperboard and textilles fo"
"370390","Photographic paper, paperboard & textiles, sensitised, unexposed, n.e.s.","370390","Photographic paper, paperboard and textilles, n"
"370400","Photographic plates, film, paper, paperboard & textiles, exposed but not developed","370400","Photographic plates, film, paper..., exposed bu"
"370510","Photographic plates & film, exposed & developed (excl. cinematographic film), for offset reproduction","370510","Photographic plates..., exposed and developed,"
"370590","Photographic plates & film, exposed&developed, other than cinematographic film (excl. of 3705.10)","370590","Photographic plates..., exposed and developed,"
"370610","Cinematographic film, exposed & developed, whether/not incorporating sound track/consisting only of sound track, of a width of 35mm/more","370610","Cinematographic film, exposed and developed, wi"
"370690","Cinematographic film, exposed & developed, whether/not incorporating sound track/consisting only of sound track, of a width of <35mm","370690","Cinematographic film, exposed and developed, wi"
"370710","Sensitising emulsions for photog. uses, put up in measured portions/put up for RS in a form ready for use","370710","Sensitising emulsions for photographic uses"
"370790","Chemical preparations for photographic uses (other than varnishes, glues, adhesives&similar preparations); unmixed products for photographic uses, put up in measured portions/put up for retail sale in a form ready for use (excl. of 3707.10)","370790","Chemical preparations for photograpic use, nes"
"380110","Artificial graphite","380110","Artificial graphite"
"380120","Colloidal/semi-colloidal graphite","380120","Colloidal graphite or semi-colloidal graphite"
"380130","Carbonaceous pastes for electrodes & similar pastes for furnace linings","380130","Carbonaceous pastes for electrodes and pastes f"
"380190","Preparations based on graphite/other carbon in the form of pastes/blocks/plates/other semi-manufactures (excl. of 3801.10-3801.30)","380190","Preparations based on graphite or carbon in the"
"380210","Activated carbon","380210","Activated carbon"
"380290","Activated natural mineral products other than of activated carbon; animal black, incl. spent animal black","380290","Activated natural mineral products; animal blac"
"380300","Tall oil, whether/not refined","380300","Tall oil, whether or not refined"
"380400","Residual lyes from the manufacture of wood pulp, whether/not concentrated/desugared/chemically treated, incl. lignin sulphonates (excl. tall oil of 38.03)","380400","Residual lyes from the manufacture of wood pulp"
"380510","Gum/wood/sulphate turpentine oils","380510","Gum, wood or sulphate turpentine oils"
"380590","Terpenic oils produced by the distillation/other treatment of coniferous woods; crude dipentene; sulphite turpentine&other crude para-cymene; pine oil containing alpha-terpineol as the main constituent.","380590","Other turpenic oils, nes; crude dipentene, etc"
"380610","Rosin & resin acids","380610","Rosin and resin acids"
"380620","Salts of rosin/resin acids/derivatives of rosin/resin acids (excl. salts of rosin adducts)","380620","Salts of rosin or of resin acids"
"380630","Ester gums","380630","Ester gums"
"380690","Derivatives of rosin/resin acids (excl. of 3806.2); rosin spirit & rosin oils; run gums","380690","Derivatives of rosin and resin acids, nes; rosi"
"380700","Wood tar; wood tar oils; wood creosote; wood naphtha; vegetable pitch; brewers' pitch & similar preparations based on rosin/resin acids/vegetable pitch","380700","Wood tar; wood tar oils; wood creosote; wood na"
"380850","Goods specified in Subheading Note 1 to this Ch.","380830","Herbicides, anti-sprouting products and plant g"
"380891","Insecticides, put up in forms/packings for retail sale/as preparations/articles ","380810","Insecticides, put up for retail sale"
"380892","Fungicides, put up in forms/packings for retail sale/as preparations/articles ","380820","Fungicides, put up for retail sale"
"380893","Herbicides, anti-sprounting products&plant-growth regulators, put up in forms/packings for retail sale/as preparations/articles ","380830","Herbicides, anti-sprouting products and plant g"
"380894","Disinfectants, put up in forms/packings for retail sale/as preparations/articles ","380840","Disinfectants, put up for retail sale"
"380899","Rodenticides&other biocides, n.e.s.,put up in forms/packings for retail sale/as preparations/articles ","380890","Rodenticides and similar products, put up for r"
"380910","Finishing agents, dye carriers to accelerate the dyeing/fixing of dyestuffs & other products & preparations, with a basis of amylaceous substance","380910","Finishing agents, etc, with amylaceous basis"
